4,because at the end of the
4,what do you have in mind
4,in the united states which is
4,were going to do something about
4,and you are going to get
4,as you point out in your
4,the fact that they are not
4,are a lot of different ways
4,i want to live in a
4,over the last 40 or 50
4,over the last couple of years
4,but when you look at the
4,has to do with the fact
4,so one of the problems with
4,i think you are right that
4,is a lot of uncertainty about
4,i think thats a lot of
4,me say it a different way
4,a good thing or a bad
4,if you want to be a
4,what they are trying to do
4,in the united states a lot
4,are more likely to be in
4,which i think is a very
4,to be able to do it
4,the case of fannie and freddie
4,think this is one of the
4,and then all of a sudden
4,on both sides of the market
4,send me an email at mailecontalkorg
4,there was a great deal of
4,do what you want to do
4,the repeal of the corn laws
4,the theory of moral sentiments by
4,in the united states we dont
4,there are people out there who
4,reminds me a little bit of
4,the beginning of the 20th century
4,thats just the way it is
4,if you are worried about the
4,i think that one of the
4,that guest well first of all
4,me ask you a different question
4,there are two ways to get
4,have to be able to do
4,of people in the united states
4,there is still a lot of
4,you get to a point where
4,in the book one of the
4,you look at the history of
4,a lot of time talking about
4,live in the washington dc area
4,what might we do to make
4,dont pay a lot of attention
4,has done a lot of work
4,to figure out how it is
4,there is a lot of uncertainty
4,they imagine they can design and
4,let me go back to the
4,there is a lot of evidence
4,russ were going to talk about
4,maybe well come back to that
4,one of the great things about
4,they are going to go out
4,the time you get to the
4,live in a world where people
4,and you are talking about the
4,let me give you another example
4,about the state of the economy
4,that a lot of people are
4,in the united states there are
4,our present difficulty is that we
4,the number of people in the
4,to make as much money as
4,but a lot of it is
4,im going to put you in
4,a bunch of people who say
4,one of the points i make
4,go so far as to say
4,i want to ask you one
4,let me ask you about one
4,the more likely you are to
4,would seem to be a good
4,is if you are going to
4,this is the kind of thing
4,that could be part of the
4,dont have to worry about that
4,you want to go back to
4,all your eggs in one basket
4,of the rest of the economy
4,get the most out of life
4,well come back to that later
4,in the last couple of years
4,of our present difficulty is that
4,people at the top of the
4,to men how little they know
4,the be all and end all
4,what we ought to be doing
4,the early part of the 20th
4,we are in the middle of
4,i dont know the answer to
4,take risks for the sake of
4,at the height of the financial
4,of them are going to be
4,example in the book of the
4,the height of the financial crisis
4,let me put it this way
4,to sell something for more than
4,one of the things that makes
4,one of the things he says
4,but i dont think we can
4,in terms of the business cycle
4,they are not going to have
4,have a very good understanding of
4,i think youd be hardpressed to
4,in the savings and loan crisis
4,you have skin in the game
4,there are going to be some
4,makes a lot of sense to
4,dont want to be wiped out
4,to be able to get a
4,in the united states and you
4,think there are two things that
4,there is an immense amount of
4,the world was coming to an
4,the other point i want to
4,on the other hand you have
4,i think for a lot of
4,the government would bail them out
4,what we can do is we
4,what do you think of the
4,i just want to mention to
4,united states off the gold standard
4,do you think we ought to
4,but on the other hand there
4,for a couple of reasons one
4,well if you look at the
4,are going to go out of
4,are a lot of things in
4,and those of us who are
4,you dont know what you are
4,that if you go back to
4,but there is a lot of
4,one of the things that has
4,to figure out a way to
4,led by an invisible hand to
4,relative to the size of the
4,that you are not going to
4,and get your reaction to it
4,what does it mean to say
4,there are lots and lots of
4,come up with a way to
4,policy on the part of the
4,somebody would have picked it up
4,going on in the united states
4,are going to be people who
4,in the aftermath of the 2008
4,so i think there is a
4,but i think its important to
4,you want to react to that
4,between the two of them and
4,are the easiest person to fool
4,i think one of the most
4,where there are a lot of
4,you want to be able to
4,the international monetary fund imf and
4,what do you think are the
4,question as to whether or not
4,to come to a group of
4,so i have to be careful
4,you talk in the book about
4,we were one of the first
4,of the rest of the world
4,who are the people who are
4,there are a number of things
4,what you are really saying is
