10,the curious task of economics is to demonstrate to
10,of labor is limited by the extent of the
10,division of labor is limited by the extent of
9,of economics is to demonstrate to men how little
9,labor is limited by the extent of the market
9,really know about what they imagine they can design
9,economics is to demonstrate to men how little they
9,task of economics is to demonstrate to men how
9,curious task of economics is to demonstrate to men
8,how little they really know about what they imagine
8,little they really know about what they imagine they
8,they really know about what they imagine they can
8,the division of labor is limited by the extent
7,the nature and causes of the wealth of nations
7,men how little they really know about what they
7,to men how little they really know about what
6,into the nature and causes of the wealth of
6,inquiry into the nature and causes of the wealth
5,more likely to be in prison or jail than
5,demonstrate to men how little they really know about
5,to demonstrate to men how little they really know
5,is to demonstrate to men how little they really
4,fool yourself and you are the easiest person to
4,2013 russ our topic for today is your book
4,likely to be in prison or jail than are
4,are more likely to be in prison or jail
4,an inquiry into the nature and causes of the
4,know about what they imagine they can design and
4,hayek the curious task of economics is to demonstrate
4,is to demonstrate to men how little they know
4,yourself and you are the easiest person to fool
3,you must not fool yourself and you are the
3,to their friends they just have different friends but
3,adjust our lives our thoughts and our emotions in
3,they know about what they imagine they can design
3,the microcosmos ie of the small band or troop
3,all their money back 100 cents on the dollar
3,little they know about what they imagine they can
3,to men how little they know about what they
3,microcosmos ie of the small band or troop or
3,often make us wish to do we would destroy
3,must learn to live in two sorts of world
3,things in the world to come to a group
3,more intimate groupings we would crush them so we
3,come to a group of people set their hearts
3,learn to live in two sorts of world at
3,lack all conviction while the worst are full of
3,we must learn to live in two sorts of
3,their friends they just have different friends but they
3,apply the rules of the extended order to our
3,yet if we were always to apply the rules
3,of how to get the most out of life
3,so we must learn to live in two sorts
3,we would crush them so we must learn to
3,to demonstrate to men how little they know about
3,the extended order to our more intimate groupings we
3,men how little they know about what they imagine
3,sentimental yearnings often make us wish to do we
3,said theres a lot of ruin in a nation
3,best lack all conviction while the worst are full
3,i think theres a lot to be said for
3,the rules of the extended order to our more
3,rules of the extended order to our more intimate
3,at the end of the book you talk about
3,how little they know about what they imagine they
3,study of how to get the most out of
3,them so we must learn to live in two
3,economics is the study of how to get the
3,you and i have talked about this before on
3,not fool yourself and you are the easiest person
3,of the cruelest things in the world to come
3,in the world to come to a group of
3,world to come to a group of people set
3,one of the cruelest things in the world to
3,to a group of people set their hearts on
3,to apply the rules of the extended order to
3,make us wish to do we would destroy it
3,of the extended order to our more intimate groupings
3,extended order to our more intimate groupings we would
3,up on the library of economics and liberty website
3,the world to come to a group of people
3,to our more intimate groupings we would crush them
3,federal deposit insurance corporation improvement act fdicia which was
3,of our present difficulty is that we must constantly
3,cruelest things in the world to come to a
3,our lives our thoughts and our emotions in order
3,is the study of how to get the most
3,and sentimental yearnings often make us wish to do
3,i want to come back to that in a
3,the right thing to do is the thing that
3,all conviction while the worst are full of passionate
3,as you point out there are a lot of
3,would crush them so we must learn to live
3,that inflation is always and everywhere a monetary phenomenon
3,only one social science and we are its practitioners
3,order to our more intimate groupings we would crush
3,groupings we would crush them so we must learn
3,rules if we were to apply the unmodified uncurbed
3,conviction while the worst are full of passionate intensity
3,if we were always to apply the rules of
3,crush them so we must learn to live in
3,what do you think of that guest i think
3,intimate groupings we would crush them so we must
3,to give money to their friends they just have
3,our present difficulty is that we must constantly adjust
3,that the division of labor is limited by the
3,must not fool yourself and you are the easiest
3,yearnings often make us wish to do we would
3,of the small band or troop or of say
3,to come to a group of people set their
3,demonstrate to men how little they know about what
3,the study of how to get the most out
3,money to their friends they just have different friends
3,part of our present difficulty is that we must
3,to sell something for more than it is worth
3,ie of the small band or troop or of
3,a group of people set their hearts on fire
3,the best lack all conviction while the worst are
3,our more intimate groupings we would crush them so
3,like to give money to their friends they just
3,were always to apply the rules of the extended
3,what we are going to talk about today is
3,give money to their friends they just have different
3,whether you are on the left or the right
3,the cruelest things in the world to come to
3,always to apply the rules of the extended order
3,we were always to apply the rules of the
2,that is increasingly hard as science becomes increasingly networked
2,a statement about the limits of reason which is
2,us wish to do we would destroy it yet
2,and you are the easiest person to fool its
2,it is led by a reasonably enlightened group of
2,the function of the philosophy of science to tell
2,but without the division of labor there can be
2,the other point i want to make which i
2,smith division of labor is limited by the extent
2,invest in google and you invest in the 100
2,if they dont do that they are not going
2,trading as a more equitable means of maximizing individual
2,state laws that constrain the companies didnt fight them
2,abridges the privileges or immunities of the citizens of
2,emotions in order to live simultaneously within different kinds
2,and i have talked about this before on the
2,little bit to the left of the house delegation
2,to smash it and through your own hubrisit just
2,what to do and i know a lot of
2,slack in some sectors as a general glut but
2,questions and involves becoming incredibly knowledgeable about these fields
2,of labor but without the division of labor there
2,want to go back to something you said a
2,might be a good thing might be a bad
2,to get back up to the trend line we
2,is this a good idea is this a good
2,i dont think you talk about in the book
2,orders according to different rules if we were to
2,what the rules of the game are going to
2,we must constantly adjust our lives our thoughts and
2,so i think theres a lot to be said
2,dont need their local banker like they used to
2,your neighbor over the head and take his stuff
2,dont know what to do and i know a
2,division of labor being limited by the extent of
2,many ways its one of the cruelest things in
2,for liberty private property public administration and the rule
2,is led by a reasonably enlightened group of people
2,going to be different and to take that dream
2,a little bit to the left of the house
2,but sea levels have been rising for several centuries
2,if any is left for parents to be increasing
2,just its so depressing partly because those arguments tend
2,dont put all your eggs in one basket and
2,what are your thoughts on that guest well i
2,party might like the book some people in the
2,be in prison or jail than are whites or
2,engage in substantial gainful activity in the us economy
2,piece has a principle of motion of its own
2,group of people set their hearts on fire saying
2,really there somebody would have picked it up already
2,they dont need their local banker like they used
2,easy to quit smoking ive done it a score
2,wealth of nations or the theory of moral sentiments
2,you invest in the 100 losers you are a
2,house collapses and kills the owner of the house
2,through your own hubrisit just its so depressing partly
2,i think a lot of people have a romance
2,and we are not going to be able to
2,but they have one friend in common which is
2,the unmodified uncurbed rules of the microcosmos ie of
2,venture capitalist who had the opportunity to invest in
2,set their hearts on fire saying im going to
2,will be done who will work how will compensation
2,it and through your own hubrisit just its so
2,to be different and to take that dream which
2,and i dont think we have a very good
2,jumping off point we are going to use a
2,simultaneously within different kinds of orders according to different
2,the privileges or immunities of the citizens of the
2,task of economics is to illustrate to men how
2,an occupation where some people are better than others
2,will ask the builder to cut corners otherwise they
2,the basic principle of banking which is know your
2,every venture capitalist who had the opportunity to invest
2,yourself and that is increasingly hard as science becomes
2,recipients of public services are going to get squeezed
2,it a sin to sell something for more than
2,and moneyand your lives are going to be different
2,the united states is the only country that has
2,be some equilibrium people will ask the builder to
2,all the different members of it are bound together
2,some sectors as a general glut but some sectors
2,friend in common which is the financial sector and
2,best way to think about teaching is to think
2,in many waysand you concede that the program had
2,google and you invest in the 100 losers you
2,to be some equilibrium people will ask the builder
2,rich people are happier than poor people the second
2,up to the trend line we were on before
2,said its easy to quit smoking ive done it
2,but when it is led by a reasonably enlightened
2,the macrocosmos our wider civilisation as our instincts and
2,right questions and involves becoming incredibly knowledgeable about these
2,magic of expertise and wisdom and moneyand your lives
2,im going to change your life theres magic comingits
2,russ lets shift gears i want to talk about
2,as a more equitable means of maximizing individual satisfaction
2,other point i want to make which i think
2,deposit insurance or other federal government protection or guarantees
2,so you have to find a solution to that
2,it works even if you dont believe in it
2,to that in a second but i want to
2,out of the 18th century and put him in
2,in some sectors as a general glut but some
2,friends but they have one friend in common which
2,collapses and kills the owner of the house the
2,troop or of say our families to the macrocosmos
2,program had some positive effectsbut in many ways its
2,and get your reaction to it which is that
2,that a large sheepskin effect would show that signaling
2,everyone took for granted that a large sheepskin effect
2,back up to the trend line we were on
2,they spend a bit of it to get more
2,dream which every human being has of a better
2,is only one social science and we are its
2,and through your own hubrisit just its so depressing
2,large sheepskin effect would show that signaling was important
2,we know a lot about how much difference there
2,chuck williams dean of butler universitys college of business
2,was very poorly received in the united states and
2,constrain the companies didnt fight them state by state
2,our wider civilisation as our instincts and sentimental yearnings
2,or immunities clause of the 14th amendment which says
2,thats why they are asking for scaling up the
2,of orders according to different rules if we were
2,we were to apply the unmodified uncurbed rules of
2,the things i talk about in the book is
2,of the book is based on the idea that
2,as competition arises from overseas the division of the
2,using the internet to increase their power and its
2,unmodified uncurbed rules of the microcosmos ie of the
2,and one of the things i talk about in
2,interesting point state laws that constrain the companies didnt
2,the earth been divided into equal portions among all
2,they look like the students who go to the
2,to take that dream which every human being has
2,macrocosmos our wider civilisation as our instincts and sentimental
2,if you dont pay people enough you are not
2,fire saying im going to change your life theres
2,equilibrium people will ask the builder to cut corners
2,builder to cut corners otherwise they cant afford the
2,dont have to worry about the value of their
2,fight them state by state as competition arises from
2,fields yourself and that is increasingly hard as science
2,change your life theres magic comingits the magic of
2,band or troop or of say our families to
2,but before i do that i want you to
2,way to think about teaching is to think about
2,in that space between the individual and the state
2,to illustrate to men how little they really know
2,to apply the unmodified uncurbed rules of the microcosmos
2,part of the problem not part of the solution
2,or of say our families to the macrocosmos our
2,that there is a group of teachers at the
2,you concede that the program had some positive effectsbut
2,people to dig ditches and fill them back in
2,people the right questions and involves becoming incredibly knowledgeable
2,russ i want to come back to that in
2,some of them will have to do with public
2,so depressing partly because those arguments tend to win
2,human being has of a better life especially for
2,a hayek the curious task of economics is to
2,lot of inflation in the energy sector this year
2,relative to the assets that have been set aside
2,part of what jeffrey sachs does that i think
2,its one of the cruelest things in the world
2,children and to smash it and through your own
2,to the macrocosmos our wider civilisation as our instincts
2,had the earth been divided into equal portions among
2,willing to use the power of the state to
2,uncurbed rules of the microcosmos ie of the small
2,are the product of human action but not human
2,of people set their hearts on fire saying im
2,hubrisit just its so depressing partly because those arguments
2,you have to take that into account you cant
2,going to have to figure out a way to
2,dont think thats the right way to think about
2,who cant get out of bed in the morning
2,to laertes neither a borrower nor a lender be
2,say it works even if you dont believe in
2,we dont have a thermometer that can tell us
2,or troop or of say our families to the
2,and i think this might be the most important
2,but if they dont have it when i get
2,apply the unmodified uncurbed rules of the microcosmos ie
2,to quit smoking ive done it a score of
2,laws that constrain the companies didnt fight them state
2,among young black men who have dropped out of
2,a lot of inflation in the energy sector this
2,im going to read another quote from the book
2,they just have different friends but they have one
2,and recipients of public services are going to get
2,no division of labor but without the division of
2,for today is a recent article you wrote for
2,pay people enough you are not going to get
2,are they going to do they are going to
2,be different and to take that dream which every
2,civilisation as our instincts and sentimental yearnings often make
2,in china was a bunch of women with knitting
2,one friend in common which is the financial sector
2,is to illustrate to men how little they really
2,and as a jumping off point we are going
2,poloniuss advice to laertes neither a borrower nor a
2,do we would destroy it yet if we were
2,the magic of expertise and wisdom and moneyand your
2,general glut but some sectors are healthy only some
2,earth been divided into equal portions among all its
2,dying on the job and everyone else has a
2,is that we must constantly adjust our lives our
2,if we were to apply the unmodified uncurbed rules
2,i weighed all the facts and i came to
2,1982 with the tax equity and fiscal responsibility act
2,get back up to the trend line we were
2,critics lay down for what is sublime and elegant
2,young black men who have dropped out of high
2,and i dont have a straight answer to it
2,these fields yourself and that is increasingly hard as
2,nature and causes of the wealth of nations so
2,in many ways its one of the cruelest things
2,think about teaching is to think about what would
2,to be loved and to be lovely we want
2,going to change your life theres magic comingits the
2,without the division of labor there can be no
2,for granted that a large sheepskin effect would show
2,are going to be different and to take that
2,present difficulty is that we must constantly adjust our
2,taxpayers and recipients of public services are going to
2,theres magic comingits the magic of expertise and wisdom
2,didnt fight them state by state as competition arises
2,about teaching is to think about what would you
2,many waysand you concede that the program had some
2,asked what are firms but why are there firms
2,a jumping off point we are going to use
2,statement about the limits of reason which is a
2,in prison or jail than are whites or hispanics
2,effectsbut in many ways its one of the cruelest
2,who can throw a baseball 100 miles an hour
2,liberty private property public administration and the rule of
2,division of labor but without the division of labor
2,destroy it yet if we were always to apply
2,must constantly adjust our lives our thoughts and our
2,smash it and through your own hubrisit just its
2,to do in this book is to say that
2,led by a reasonably enlightened group of people as
2,it yet if we were always to apply the
2,economics is to illustrate to men how little they
2,i have talked about this before on the program
2,mark twain said its easy to quit smoking ive
2,what are they going to do they are going
2,when fortresses and virgins get to talking the end
2,have it when i get there i fire them
2,federal deposit insurance or other federal government protection or
2,about what happened on piper alpha the more i
2,will developed into trading as a more equitable means
2,to be in prison or jail than are women
2,that are the product of human action but not
2,4 2012 russ were going to talk about your
2,live in a world where its okay to steal
2,i dont think thats the right way to think
2,see slack in some sectors as a general glut
2,that they dont have any interest in being able
2,to go back to something you said a minute
2,have different friends but they have one friend in
2,if we had played by the rules of capitalism
2,faster than employment in the rest of the labor
2,its going to look like you started the fight
2,had some positive effectsbut in many ways its one
2,sachs does that i think is so destructive and
2,incredibly knowledgeable about these fields yourself and that is
2,the companies didnt fight them state by state as
2,in two sorts of world at once italics original
2,smith the division of labor is limited by the
2,of say our families to the macrocosmos our wider
2,you are unable to engage in substantial gainful activity
2,any law that abridges the privileges or immunities of
2,their children and to smash it and through your
2,families to the macrocosmos our wider civilisation as our
2,you dont need to go back and figure out
2,dont want to live in a world where people
2,statement that inflation is always and everywhere a monetary
2,labor but without the division of labor there can
2,is the last thing we have to worry about
2,magic comingits the magic of expertise and wisdom and
2,knowledgeable about these fields yourself and that is increasingly
2,good will developed into trading as a more equitable
2,smith said theres a lot of ruin in a
2,principle is you must not fool yourself and you
2,who do you think is going to win russ
2,youve got to make the case you cant just
2,different and to take that dream which every human
2,basic principle of banking which is know your customer
2,the product of human action but not human design
2,if the stock price goes up i make money
2,lives our thoughts and our emotions in order to
2,theres got to be some equilibrium people will ask
2,bang your neighbor over the head and take his
2,expertise and wisdom and moneyand your lives are going
2,according to different rules if we were to apply
2,that you are unable to engage in substantial gainful
2,people who take risks for the sake of others
2,within different kinds of orders according to different rules
2,the top 1 or the top tenth of 1
2,by the organization for economic cooperation and development oecd
2,2013 russ our topic for today is a recent
2,instincts and sentimental yearnings often make us wish to
2,has of a better life especially for their children
2,people who are best able to determine how many
2,have to worry about the value of their investments
2,state by state as competition arises from overseas the
2,the free market interest rate will tend to fall
2,as a jumping off point we are going to
2,of the 18th century and put him in a
2,is that a good thing or a bad thing
2,many of the best hackers in the world have
2,i look forward to talking to you about that
2,to pay for the retirements of public sector employees
2,necessarily take the job that pays the most money
2,some positive effectsbut in many ways its one of
2,your own hubrisit just its so depressing partly because
2,in college to think otherwise is the pretense of
2,want to come back to that in a second
2,because we dont like the way the world is
2,the program had some positive effectsbut in many ways
2,quit smoking ive done it a score of times
2,a lot of what you are talking about is
2,people enough you are not going to get motivation
2,live in two sorts of world at once italics
2,trying to steal a euro from an old lady
2,of what jeffrey sachs does that i think is
2,adam ferguson things that are the result of human
2,your lives are going to be different and to
2,the rules of the game are going to be
2,wish to do we would destroy it yet if
2,the right questions and involves becoming incredibly knowledgeable about
2,100 cents on the dollar because jp morgan chase
2,which the articles of confederation did not have it
2,a sin to sell something for more than it
2,to engage in substantial gainful activity in the us
2,to change your life theres magic comingits the magic
2,this is good for you i dont like it
2,by state as competition arises from overseas the division
2,to think about teaching is to think about what
2,were going to have to figure out a way
2,is not part of the revolving door in a
2,and involves becoming incredibly knowledgeable about these fields yourself
2,the budget over the life of the business cycle
2,wisdom and moneyand your lives are going to be
2,the best way to think about teaching is to
2,we still need to be doing everything we can
2,is increasingly hard as science becomes increasingly networked and
2,what are your thoughts on where we are heading
2,sin to sell something for more than it is
2,are much more likely to be in prison or
2,life theres magic comingits the magic of expertise and
2,being invited to testify in front of congress and
2,not part of the revolving door in a literal
2,to be in prison or jail than are whites
2,in google and you invest in the 100 losers
2,are things that are the product of human action
2,p 18 part of our present difficulty is that
2,at the end of the day a lot of
2,you point out in the book one of the
2,at the actual history of lighthouses in great britain
2,room if any is left for parents to be
2,our emotions in order to live simultaneously within different
2,friedman and schwartzs monetary history of the united states
2,any is left for parents to be increasing the
2,china was a bunch of women with knitting needles
2,than it was at the height of the financial
2,the discount rate that we apply to monetary benefits
2,russ im just making the point that i think
2,i dont want to be ruled by the majority
2,as our instincts and sentimental yearnings often make us
2,ask the builder to cut corners otherwise they cant
2,want to show that if your mom works and
2,in his presidential address to the american economic association
2,people running the system of the antitrust law its
2,and yet in many waysand you concede that the
2,that the right thing to do is the thing
2,man wants to be loved and to be lovely
2,order to live simultaneously within different kinds of orders
2,they dont have it when i get there i
2,we live in a world where people have a
2,want to make the pie as big as possible
2,called the federal deposit insurance corporation improvement act fdicia
2,illustrate to men how little they really know about
2,dont have it when i get there i fire
