2,a judgment about whats the right thing to do
2,you have a lot of interesting things to say
2,being has of a better life especially for their
2,that we dont know what would have happened otherwise
2,i want to come back to this issue of
2,and virgins get to talking the end is in
2,part of the book is based on the idea
2,arises from overseas the division of the pie is
2,it doesnt matter what you spend the money on
2,that will tell you whether monetary policy is too
2,adam smith said theres a lot of ruin in
2,factory in china was a bunch of women with
2,a good thing might be a bad thing but
2,so i think theres something to john taylors argument
2,and so you have to find a solution to
2,asking the right people the right questions and involves
2,which every human being has of a better life
2,to do we would destroy it yet if we
2,better life especially for their children and to smash
2,hearts on fire saying im going to change your
2,the right people the right questions and involves becoming
2,and to take that dream which every human being
2,to give the listeners a little bit of the
2,be in prison or jail than are women africanamericans
2,theres been a lot of inflation in the energy
2,what are your thoughts on that guest well this
2,much room if any is left for parents to
2,them state by state as competition arises from overseas
2,question is how much should i charge for it
2,its so depressing partly because those arguments tend to
2,how little they understand about what they imagine they
2,some equilibrium people will ask the builder to cut
2,to think about what would you do if you
2,of the microcosmos ie of the small band or
2,there is only one social science and we are
2,difficulty is that we must constantly adjust our lives
2,virgins get to talking the end is in sight
2,that we were going to run out of oil
2,and i know many people over the age of
2,can master in college to think otherwise is the
2,point i want to make which i think is
2,is you must not fool yourself and you are
2,a better life especially for their children and to
2,have to take that into account you cant just
2,if they dont have it when i get there
2,of economics is to illustrate to men how little
2,go back to something you said a minute ago
2,but as you point out in the book a
2,topic for today is a recent article you wrote
2,constantly adjust our lives our thoughts and our emotions
2,is an occupation where some people are better than
2,for their children and to smash it and through
2,the students who go to the ivy league schools
2,makes it harder for other people to play the
2,it harder for other people to play the game
2,state as competition arises from overseas the division of
2,they have one friend in common which is the
2,about these fields yourself and that is increasingly hard
2,master in college to think otherwise is the pretense
2,russ our topic for today is your book the
2,were to apply the unmodified uncurbed rules of the
2,their money back 100 cents on the dollar because
2,becoming incredibly knowledgeable about these fields yourself and that
2,to live simultaneously within different kinds of orders according
2,small band or troop or of say our families
2,think that the best way to think about teaching
2,we would destroy it yet if we were always
2,f a hayek the curious task of economics is
2,sectors as a general glut but some sectors are
2,insight that the division of labor is limited by
2,sell something for more than it is worth and
2,this a good idea is this a good idea
2,to live in a world where its okay to
2,that among young black men who have dropped out
2,balance the budget over the life of the business
2,wanting to claim that you can make things better
2,kinds of orders according to different rules if we
2,say our families to the macrocosmos our wider civilisation
2,of labor being limited by the extent of the
2,our families to the macrocosmos our wider civilisation as
2,our thoughts and our emotions in order to live
2,they both like to give money to their friends
2,think a lot of people have a romance about
2,what are firms but why are there firms and
2,a lot about how much difference there is between
2,the house collapses and kills the owner of the
2,are more valuable than they used to be which
2,by the way i dont want to suggest that
2,our topic for today is a recent article you
2,different friends but they have one friend in common
2,different rules if we were to apply the unmodified
2,wants to be loved and to be lovely we
2,saying im going to change your life theres magic
2,will be most comfortable talking about it in terms
2,the federal deposit insurance corporation improvement act fdicia which
2,dont pay people enough you are not going to
2,would destroy it yet if we were always to
2,trying to do in this book is to say
2,you want to see him be able to take
2,of dying on the job and everyone else has
2,know what to do and i know a lot
2,you dont put all your eggs in one basket
2,dont want to be ruled by the majority rule
2,especially for their children and to smash it and
2,what jeffrey sachs does that i think is so
2,a reasonably enlightened group of people as china is
2,and kills the owner of the house the architect
2,thats too much im not going to pay that
2,that china is going to get ahead of us
2,that the best way to think about teaching is
2,people set their hearts on fire saying im going
2,are unable to engage in substantial gainful activity in
2,because the more people you can exchange with the
2,of the things i talk about in the book
2,by a reasonably enlightened group of people as china
2,twain said its easy to quit smoking ive done
2,that dream which every human being has of a
2,law that abridges the privileges or immunities of the
2,fortresses and virgins get to talking the end is
2,is left for parents to be increasing the similarity
2,things that are the product of human action but
2,there is a group of teachers at the bottom
2,privileges or immunities clause of the 14th amendment which
2,dont be so arrogant to think that you can
2,to report on what they did with the money
2,our instincts and sentimental yearnings often make us wish
2,own hubrisit just its so depressing partly because those
2,waysand you concede that the program had some positive
2,there are things that are the product of human
2,dont necessarily take the job that pays the most
2,yet in many waysand you concede that the program
2,ways its one of the cruelest things in the
2,more valuable than they used to be which is
2,18 part of our present difficulty is that we
2,lot of people thought it would be killed by
2,little bit not a lot but a little bit
2,people will ask the builder to cut corners otherwise
2,that getting the united states off the gold standard
2,got to make the case you cant just say
2,you can master in college to think otherwise is
2,look like the students who go to the ivy
2,franklin when fortresses and virgins get to talking the
2,to live in two sorts of world at once
2,jeffrey sachs does that i think is so destructive
2,1 in 10 chance that we are going to
2,moneyand your lives are going to be different and
2,that the program had some positive effectsbut in many
2,ferguson things that are the result of human action
2,russ but as you point out in the book
2,would balance the budget over the life of the
2,its easy to quit smoking ive done it a
2,careful to come on time and if he charges
2,i think its more than that i think its
2,the builder to cut corners otherwise they cant afford
2,life especially for their children and to smash it
2,in the fifth book of the wealth of nations
2,the more i thought about it the more i
2,unable to engage in substantial gainful activity in the
2,like the students who go to the ivy league
2,what do you have in mind when you say
2,the pie is not as big as it could
2,point state laws that constrain the companies didnt fight
2,hayek said the curious task of economics is to
2,that abridges the privileges or immunities of the citizens
2,i take your point and i think its a
2,a lot of people thought it would be killed
2,to cut corners otherwise they cant afford the house
2,know a lot about how much difference there is
2,were going to talk about a number of issues
2,at george mason when i look to the future
2,that constrain the companies didnt fight them state by
2,when it is led by a reasonably enlightened group
2,some of them will do it because of the
2,every human being has of a better life especially
2,into trading as a more equitable means of maximizing
2,much more likely to be in prison or jail
2,a general glut but some sectors are healthy only
2,the diagnostic and statistical manual of mental disorders dsm
2,the more people you can exchange with the more
2,dream dreams that never were and ask why not
2,been a lot of inflation in the energy sector
2,they say it works even if you dont believe
2,designed for liberty private property public administration and the
2,rules of the microcosmos ie of the small band
2,comingits the magic of expertise and wisdom and moneyand
2,you have to find a solution to that and
2,russ our topic for today is a recent article
2,hit it on the fat part of the bat
2,different kinds of orders according to different rules if
2,granted that a large sheepskin effect would show that
2,increasingly hard as science becomes increasingly networked and crossdisciplined
2,be a good thing might be a bad thing
2,positive effectsbut in many ways its one of the
2,little they understand about what they imagine they can
2,they dont have any interest in being able to
2,creditors got pennies on the dollar 10 or 12
2,of expertise and wisdom and moneyand your lives are
2,just have different friends but they have one friend
2,from the advantage he makes of the buyers want
2,on fire saying im going to change your life
2,in prison or jail than are women africanamericans are
2,how much would you demand to be paid if
2,the people who are best able to determine how
2,benjamin franklin when fortresses and virgins get to talking
2,do you want to say anything else about the
2,a 1 in 10 chance that we are going
2,they understand about what they imagine they can design
2,adam smith the division of labor is limited by
2,and to smash it and through your own hubrisit
2,developed into trading as a more equitable means of
2,private property public administration and the rule of law
2,lay down for what is sublime and elegant in
2,is to think about what would you do if
2,how much work will be done who will work
2,as adam smith said theres a lot of ruin
2,the curious task of economics is to illustrate to
2,you want to make the pie as big as
2,the small band or troop or of say our
2,as you point out in the book there are
2,live simultaneously within different kinds of orders according to
2,is it a sin to sell something for more
2,want to be ruled by the majority rule of
2,i just want to make sure i understand the
2,and our emotions in order to live simultaneously within
2,we dont know how to do it very well
2,a little bit not a lot but a little
2,black men who have dropped out of high school
2,if you have low skill and you live in
2,take that dream which every human being has of
2,that we must constantly adjust our lives our thoughts
2,to show that if your mom works and you
2,involves becoming incredibly knowledgeable about these fields yourself and
2,college to think otherwise is the pretense of knowledge
2,and wisdom and moneyand your lives are going to
2,curious task of economics is to illustrate to men
2,they dont do that they are not going to
2,money back 100 cents on the dollar because jp
2,to make the case you cant just say theres
2,right people the right questions and involves becoming incredibly
2,not from the benevolence of the butcher the brewer
2,the division of labor there can be no stock
2,took for granted that a large sheepskin effect would
2,your life theres magic comingits the magic of expertise
2,harmed the people he supposedly set out to help
2,lives are going to be different and to take
2,wider civilisation as our instincts and sentimental yearnings often
2,a large sheepskin effect would show that signaling was
2,got all their money back 100 cents on the
2,work will be done who will work how will
2,thoughts and our emotions in order to live simultaneously
2,see how much room if any is left for
2,got to be some equilibrium people will ask the
2,of a better life especially for their children and
2,back 100 cents on the dollar because jp morgan
2,companies didnt fight them state by state as competition
2,be most comfortable talking about it in terms of
2,advice to laertes neither a borrower nor a lender
2,you dont pay people enough you are not going
2,much work will be done who will work how
2,you would balance the budget over the life of
2,and that is increasingly hard as science becomes increasingly
2,their hearts on fire saying im going to change
2,have one friend in common which is the financial
2,the question is what do you do about that
2,as prices go up people find more ways to
2,and i think thats true of a lot of
2,no federal deposit insurance or other federal government protection
2,off point we are going to use a recent
2,it was at the height of the financial crisis
2,friends they just have different friends but they have
2,as a general glut but some sectors are healthy
2,concede that the program had some positive effectsbut in
2,pay for dinner again and youll never get an
2,sell something for more than it is worth well
2,all the videos and 300 did all the work
2,and you invest in the 100 losers you are
2,say that the right thing to do is the
2,in order to live simultaneously within different kinds of
2,teaching is to think about what would you do
2,how much room if any is left for parents
2,dont think you talk about in the book is
2,but they say it works even if you dont
2,from overseas the division of the pie is harder
2,know about what they imagine they can design which
2,to different rules if we were to apply the
2,both like to give money to their friends they
2,i think that the best way to think about
2,only from the advantage he makes of the buyers
2,competition arises from overseas the division of the pie
1,of speed and prices and as a consequence penetration
1,famous bernanke quote where he apologizes to milton friedman
1,at 12 years old i think the economistss answer
1,model austrian school textbooks teach equilibrium its easier and
1,in the late 1920s bukharin and stalin spar over
1,continue to be surprised by what nature dishes out
1,1962 economic report of the president but of course
1,paul krugman or read his blog hes been very
1,left to die lehmanbrothers is in bankruptcy not disruptive
1,elections for example in tanzania two years ago went
1,they happen they are deeper so they have a
1,have a sense of the duration so when shocks
1,to materialize 5803 russ one last comment on the
1,insolvency at the time of the run or heavily
1,also split up the population by race and whether
1,what we know on the contrary is that people
1,is the united states has a credible federal deposit
1,one is that there was a political process that
1,russ they were onto something werent they guest yeah
1,book looks at globalization in the 1600s growing ties
1,are a lot more people living together and sharing
1,do we do this quiz how do we do
1,got most of the aca so what do we
1,really failed and its incredibly destructive and yes the
1,does not mean that the consequences for society will
1,include people by the way with super quality health
1,this high scale could be a feature efficient school
1,are benevolent but it could be truethat we are
1,though when you think about local redistribution so i
1,hes also a fan of that also but we
1,out of business they are not going to be
1,central banks today they tried for a long time
1,public image their training what role do you play
1,but what it leaves out is when i make
1,people theyits middle management ideally that takes the successes
1,somehow theres this ceiling on government spending im all
1,econtalk as well guest that he very much regretted
1,money that would help i think make the world
1,them if its an american riding his bicycle he
1,later its too early guest theyre not too early
1,that would make it very expensive in some sense
1,and that is comparing it to family we all
1,are going to go out and buy gasoline youd
1,tremendous energy users theyve been in an environment where
1,banks would go under and demanded a price that
1,is they didnt overreact kept their policy steady didnt
1,of psychological studies guest yeah its a great point
1,country and his town estate he smokes a fiftycent
1,be as well unqualified teachers teachers working just for
1,they usually have anything to that argument no old
1,say they cant agree they dont go into recess
1,actually government policies that are simply more flexible this
1,comparative advantage when we have a boom what i
1,you can be a good peg to put in
1,up in the last podcast but i think a
1,these people are paid often by drug companies that
1,exists between counties is a very important one and
1,against a color tv and then what you do
1,simply charged a fixed production fee for each event
1,the respect of your fellow planters by looking down
1,are made by china or in vietnam by contrast
1,labor how powerful those policies were in explaining industrial
1,in the past a singularity say farming industry that
1,i read mostly people i agree with but i
1,does europeans happiness compare to americans ireland japan france
1,for you my mom had an occasional glass of
1,society with as much ease as the hand arranges
1,is extremely unrealistic i dont think there is any
1,years we are clearly very good at producing athletes
1,on your body through disease or work or something
1,is an interior maximum and i dont see that
1,wethere is a point in saying things that are
1,he basically gives that advice you are not going
1,decision to allow the southern states to keep with
1,what does history suggest about the economic implications of
1,how complex it is and have tools that can
1,problem i would again say they werent really made
1,and that often is not the first company and
1,the problem because current taxpayers participants in the political
1,effect i mean in some ways its exactly why
1,on it theyve got the colors down they know
1,that human beings are altruistic and the wn says
1,19 times youd get a 95 if you voted
1,just be misplaced and that would mean that weve
1,years and millions of dollars in the odyssey so
1,lot of sugar are obviously people who smoke a
1,this neighborhood who used to live in this low
1,i had explained to them russ get it working
1,not participate than disclose this information wouldnt we be
1,think that it goes a bit beyond that and
1,think its a dogmatic aspect its how culture advances
1,agree on what the proposal will actually collect in
1,sounds a lot like fannie and freddieget this privilege
1,but suppose this is my week for the microfinance
1,something copied but no fax machine or modern copier
1,of predatory pricing actually working to hurt consumers of
1,does not violate the law unless you charge for
1,the nogales comparison is all about showing its about
1,people like hayek and from von mises so thats
1,moral foundation and then we can match that up
1,think is right and they think is awful guest
1,we can do tax or discourage these activities but
1,or they actually come away with the wrong point
1,children changed me but folks with children tend to
1,it all guest so its a feast or famine
1,rocky and say lets help mrs smith to get
1,created an industry in the applied financial domain what
1,long at all russ if we look at the
1,a zero sum game because the winners have to
1,had a private school system and the government is
1,20 states from 1920 until 1929 had relaxed their
1,assets will have to reprice them on their books
1,it right before tiger woods had his marital escapadesi
1,the entrenched winners of the current system whether its
1,we hadnt had fannie and freddie pushing to get
1,lifestyle by any stretch of the imagination however the
1,neither guest uh both all the survey data shows
1,to the ones that resonate with their innate personality
1,places where you can start getting something going you
1,in the discussion there was a huge increase in
1,project this project is coming to an end at
1,phd diploma and encourage them to stay and welcome
1,and these discount rates the only justification for using
1,dont die very much so they are going to
1,into the distance abstract theorizing fades suddenly relevant should
1,bad but from the point of view of the
1,group but leftist coalition the midnight of the century
1,one response is i actually think there is a
1,like those parsimonious explanations they are not always right
1,to win the war in vietman crazy when you
1,got to say its weird because they are more
1,glorious as i should mention here in april as
1,thanksgiving is coming you and i seem to be
1,saying those movers are representative of all americans but
1,where i came from because i was never in
1,of bitcoin transactions happening every second that will be
1,pinto on firm ground saying that fannie and freddie
1,late and pay the 10 this is something which
1,a long enough time period that you could at
1,the casethe internet lets you do it in public
1,that is often neglected in peoples reading and understanding
1,work out you hunt to eat empirically people are
1,and collectively to go ahead with those russ and
1,press oh treasury is telling me this that type
1,noncompetitive rights in the case of canada there is
1,major impediment to this kind of regulation they could
1,well so there is a question what is the
1,can trace it back way further than thatand the
1,a meter there but for either cultural or convenience
1,of libertarianism but i think the worst strand is
1,changes the costs and benefits at the time ongoing
1,norms emerge and get passed on nonspecific reciprocityseems like
1,same obviously ups and downs question in the real
1,which is ignored usually in those measures but the
1,about consumers than about profits some of it is
1,utility or the pure rate of time preference simply
1,makes some sensea germ of truth or more in
1,the amount of money they have to lend from
1,were doing it they didnt do it as much
1,a world like this overall the entire world is
1,to fertility but thats transitioning 3301 business cycles macroeconomics
1,of the money they had used to make their
1,out the easy and trivial examples are like priceline
1,well lets talk about the outsider because thats another
1,what they know and so i think the biggest
1,that so thats where the evidence is a bit
1,prosperity and you focus on the issue of trust
1,side of the field they may not have the
1,and 12 years ago and they have been declining
1,ambitious research project whats the goal of the project
1,the only viable bidder they have to buy it
1,is not strategically beneficial for investors buying at high
1,already built up around the existing payment systems and
1,aid project to lets say build a dam build
1,the bush administrationthe political system is extremely hospitable to
1,party was going to push the democrats out of
1,about it firsthand036 intro recording date march 8 2011
1,krugman would or jacob hacker would i simply think
1,everything would fall into place enormous change in policy
1,the right answer its knowing all the wrong answers
1,has recently come out from rockstar which is the
1,the profession as it is right now033 intro recording
1,bodies that look like ours and sending sound to
1,is easier for people to swallow than the facts
1,plan of the firm had been heavily dependent on
1,in the goods market and equilibrium in the money
1,makes for the best science we have the same
1,to negotiate for you and after each session its
1,you just made that we know enough to be
1,are what you do when you produce something that
1,apple production looks like there has been an underlying
1,government structure between a quarter and a third and
1,the component parts are not too big to fail
1,the developed countries any more 2032 misconceptions people have
1,the school system delivered because it was quite carefully
1,treat our own careers and how we talk about
